{
  "codigo_iec": "S00111",
  "nombre": "Interruptor termomagnético 3P+N (unifilar)",
  "familia_atributos": "aparato",
  "estado_revision": "pendiente_revision",
  "puntos_conexion": [
    {
      "id": "OUT.6",
      "rol": "salida",
      "x": 10.0,
      "y": 20.0
    },
    {
      "id": "OUT.2",
      "rol": "salida",
      "x": -30.0,
      "y": 20.0
    },
    {
      "id": "OUT.4",
      "rol": "salida",
      "x": -10.0,
      "y": 20.0
    },
    {
      "id": "IN.1",
      "rol": "entrada",
      "x": -30.0,
      "y": -30.0
    },
    {
      "id": "IN.5",
      "rol": "entrada",
      "x": 10.0,
      "y": -30.0
    },
    {
      "id": "IN.3",
      "rol": "entrada",
      "x": -10.0,
      "y": -30.0
    },
    {
      "id": "IN.7",
      "rol": "entrada",
      "x": 30.0,
      "y": -30.0
    },
    {
      "id": "OUT.8",
      "rol": "salida",
      "x": 30.0,
      "y": 20.0
    }
  ],
  "version_libreria": "0.1.0",
  "fuente_qet": "qelectrotech/qelectrotech-elements@b9e1020:200_fuses_protective_gears/11_circuit_breakers/disjonct-m_3fn.elmt"
}
