{
  "codigo_iec": "S00118",
  "nombre": "Toma a tierra (PE)",
  "familia_atributos": "aparato",
  "estado_revision": "pendiente_revision",
  "puntos_conexion": [
    {
      "id": "PE",
      "rol": "tierra",
      "x": 0.0,
      "y": -10.0
    }
  ],
  "version_libreria": "0.1.0",
  "fuente_qet": "qelectrotech/qelectrotech-elements@b9e1020:110_network_supplies/terre.elmt"
}
