{
  "codigo_iec": "S00132",
  "nombre": "Instrumento de medición (voltímetro)",
  "familia_atributos": "aparato",
  "estado_revision": "pendiente_revision",
  "puntos_conexion": [
    {
      "id": "t1",
      "rol": "salida",
      "x": 0.0,
      "y": 20.0
    },
    {
      "id": "t2",
      "rol": "entrada",
      "x": 0.0,
      "y": -20.0
    }
  ],
  "version_libreria": "0.1.0",
  "fuente_qet": "qelectrotech/qelectrotech-elements@b9e1020:10_electric/10_allpole/390_sensors_instruments/70_meters_measuring_indicators/voltmetre-v.elmt"
}
