{
  "codigo_iec": "S00116",
  "nombre": "Tomacorriente 2P+T (unifilar)",
  "familia_atributos": "aparato",
  "estado_revision": "pendiente_revision",
  "puntos_conexion": [
    {
      "id": "t1",
      "rol": "entrada",
      "x": -6.0,
      "y": -15.0
    },
    {
      "id": "t2",
      "rol": "entrada",
      "x": 6.0,
      "y": -15.0
    },
    {
      "id": "t3",
      "rol": "salida",
      "x": 0.0,
      "y": 17.0
    }
  ],
  "version_libreria": "0.1.0",
  "fuente_qet": "qelectrotech/qelectrotech-elements@b9e1020:140_connectors_plugs/20_socket_outlets/pc_mono.elmt"
}
