{
  "codigo_iec": "S00112",
  "nombre": "Contactor de potencia (polo NA)",
  "familia_atributos": "aparato",
  "estado_revision": "pendiente_revision",
  "puntos_conexion": [
    {
      "id": "t1",
      "rol": "entrada",
      "x": 0.0,
      "y": -20.0
    },
    {
      "id": "t2",
      "rol": "salida",
      "x": 0.0,
      "y": 20.0
    }
  ],
  "version_libreria": "0.1.0",
  "fuente_qet": "qelectrotech/qelectrotech-elements@b9e1020:310_relays_contactors_contacts/02_contacts_cross_referencing/02_power_contacts/com_puiss1.elmt"
}
