{
  "codigo_iec": "S00117",
  "nombre": "Lámpara de filamento",
  "familia_atributos": "aparato",
  "estado_revision": "pendiente_revision",
  "puntos_conexion": [
    {
      "id": "t1",
      "rol": "salida",
      "x": 2.0,
      "y": 20.0
    },
    {
      "id": "t2",
      "rol": "salida",
      "x": -2.0,
      "y": 20.0
    }
  ],
  "version_libreria": "0.1.0",
  "fuente_qet": "qelectrotech/qelectrotech-elements@b9e1020:391_consumers_actuators/60_lightings/lamp.elmt"
}
