{
  "codigo_iec": "S00110",
  "nombre": "Interruptor termomagnético 1P (unifilar)",
  "familia_atributos": "aparato",
  "estado_revision": "pendiente_revision",
  "puntos_conexion": [
    {
      "id": "IN.1",
      "rol": "entrada",
      "x": 0.0,
      "y": -30.0
    },
    {
      "id": "OUT.2",
      "rol": "salida",
      "x": 0.0,
      "y": 20.0
    }
  ],
  "version_libreria": "0.1.0",
  "fuente_qet": "qelectrotech/qelectrotech-elements@b9e1020:10_electric/10_allpole/200_fuses_protective_gears/11_circuit_breakers/disjonct-m_1f.elmt"
}
